{
  "id": "2026-10-22-kangetsuen-tokachigawa",
  "candidate_id": "2026-10-22-kangetsuen-tokachigawa",
  "region": "北海道河東郡音更町十勝川温泉（十勝川温泉）",
  "category": "サウナ",
  "facility_overview": "十勝川のほとりに広がる十勝川温泉エリアの全100室の大規模ホテル『十勝川温泉 観月苑』。本場フィンランド式のロウリュを備えたサウナがあり、毎週月曜には十勝産トドマツのアロマロウリュも実施。水風呂には音更町の飲み水でもある清流・札内川の伏流水を使い、北海道では数少ないセルフロウリュ対応という独自性がある。お湯は世界でも珍しい植物由来の『モール温泉』で、十勝川沿いの庭園露天風呂が『絶景』と評判。犬同伴可能な客室（ドッグフレンドリールーム）も用意されている。",
  "recommendation_reasons": [
    "楽天トラベル4.48（1,904件）・フォートラベル3.80（78件）と、母数の異なる2つの独立した口コミサイトで確認し、楽天トラベルは推奨ライン（4.2以上）を明確に上回っている。",
    "フィンランド式の本格ロウリュ、十勝産トドマツのアロマロウリュ、札内川伏流水の水風呂という、北海道でも数少ないセルフロウリュ対応のサウナ体験。",
    "十勝川沿いの庭園露天風呂、犬同伴可能な客室という他にない独自性があり、写真映えとペット同伴旅のニーズの両方に応える。",
    "サウナ室の木材を入れ替えたばかりという最近の口コミもあり、設備の鮮度も確認できる。"
  ],
  "evaluation_basis": "100点満点中77点（口コミ評価22/25・口コミ信頼性13/15・独自体験16/20・映え11/15・価格対体験価値6/10・SNS話題性6/10・アクセス/鮮度3/5）。楽天トラベル4.48（1,904件）・フォートラベル3.80（78件）の2つの独立情報源で、採用ライン4.0以上（推奨4.2以上）を楽天トラベル側で明確に満たすことを確認。フォートラベルでは『悪い』評価が78件中1件のみで、アクセス評価がやや低め・受付時間の事前確認が必要という指摘はあったが、清潔感・接客・安全性に関わる重大な問題ではないため選定に影響しないと判断した。",
  "target_audience": ["夫婦", "記念日", "カップル", "温泉好き", "絶景好き"],
  "why_now": "10月下旬の十勝地方は朝晩すでに冬の入口の冷え込みとなり、ロウリュで発汗したあと十勝川沿いの外気浴スペースで『ととのう』のに心地よい季節。11月以降は積雪・路面凍結でアクセスの難度が上がるため、まだ移動しやすい今のうちに道東のサウナ旅として紹介する意義がある。",
  "price_note": "Web検索の範囲では部屋タイプ別の正確な1泊2食価格帯は確定できなかった。全100室で月観デッキ付きツインルームなど複数の部屋タイプがあり、プラン・時期により価格帯に幅がある（予約前に公式サイトで要確認）。",
  "access_note": "北海道河東郡音更町十勝川温泉に位置する。JR帯広駅バスターミナルから「十勝川温泉行き」路線バスで約30分、タクシーで約20分（具体的な所要時間・ダイヤは要事前確認）。",
  "captions": {
    "instagram": "札内川の伏流水で、ととのう十勝の夜。\n\n📍北海道音更町・十勝川温泉「観月苑」\n\n本場フィンランド式のロウリュを備えたサウナに、毎週月曜は十勝産トドマツのアロマロウリュも登場。水風呂には音更町の飲み水でもある清流・札内川の伏流水を使い、北海道では数少ないセルフロウリュ対応というこだわりがあります。お湯は世界でも珍しい植物由来の『モール温泉』で、十勝川沿いの庭園露天風呂からの景色も魅力。犬同伴可能な客室もあり、ペットと一緒の旅にも対応しています。\n\n楽天トラベルは1,904件で4.48、フォートラベルも78件で3.80（2026年10月時点）と、2つの独立した口コミサイトで確認済み。サウナ室の木材を入れ替えたばかりという口コミもあり、設備の鮮度も感じられます。\n\n✔️おすすめの人：記念日の夫婦旅／カップル／温泉・サウナ好き\n✔️アクセス：JR帯広駅から路線バスで約30分、タクシーで約20分\n✔️価格：プラン・部屋タイプ・時期により変動（予約前に公式サイトで要確認）\n\n※価格・プラン内容は変動するため、予約時に公式サイトで最新情報をご確認ください。\n※本投稿は実際の宿泊レポートではなく、口コミ・公式情報をもとに構成した旅行メディア型の紹介です。\n\n道東の『ととのう』旅、保存しておいて。",
    "tiktok": "十勝川沿いのセルフロウリュサウナ、知ってる？♨️\n十勝川温泉『観月苑』、本場フィンランド式のロウリュを完備。\n月曜は十勝産トドマツのアロマロウリュも。\n水風呂は札内川の伏流水、北海道でも数少ないセルフロウリュ対応。\nお湯は世界でも珍しい『モール温泉』、犬同伴OKの部屋も。\n楽天1,904件で4.48、フォートラベルでも78件で3.80の高評価。\n道東の『ととのう』旅、保存しておこう。"
  },
  "hashtags": [
    "#十勝川温泉", "#観月苑", "#モール温泉", "#音更町", "#北海道旅行",
    "#サウナ好きと繋がりたい", "#セルフロウリュ", "#ととのう", "#道東旅行", "#温泉旅館",
    "#記念日旅行", "#犬と旅行"
  ],
  "sources": [
    { "type": "review_site", "title": "十勝川温泉 観月苑 に実際に泊まった方のクチコミ・レビュー【楽天トラベル】", "url": "https://travel.rakuten.co.jp/HOTEL/19237/review.html" },
    { "type": "review_site", "title": "十勝川温泉 観月苑 クチコミ・感想 - フォートラベル", "url": "https://4travel.jp/dm_hotel-10040990" },
    { "type": "official", "title": "フィンランド式サウナ - 十勝川温泉 観月苑【公式】", "url": "https://www.kangetsuen.com/sauna/" },
    { "type": "other", "title": "十勝川温泉 観月苑 地図・アクセス - 楽天トラベル", "url": "https://hotel.travel.rakuten.co.jp/hinfo/19237/hotelmap/" },
    { "type": "review_site", "title": "十勝川温泉 観月苑 クチコミ - @nifty温泉", "url": "https://onsen.nifty.com/obihiro-onsen/onsen000177/kuchikomi/" }
  ],
  "created_date": "2026-10-22"
}
