{
  "id": "2026-10-17-ana-intercontinental-ishigaki",
  "candidate_id": "2026-10-17-ana-intercontinental-ishigaki",
  "region": "沖縄県石垣市真栄里（マエサトビーチ）",
  "category": "離島リゾート",
  "facility_overview": "石垣島のマエサトビーチ目の前に立つビーチフロントリゾート『ANAインターコンチネンタル石垣リゾート by IHG』。レストラン6店舗に加え、ベイウィング前の『サンセットプール』、オーシャン・コーラルウィング宿泊者専用の『サンライズプール』、年間利用可能な屋内プールやウォータースライダー付きガーデンプールなど、複数のプールを使い分けられる構成が特徴。ホテル周辺はウミガメと一緒に泳げるスポットとしても知られる。",
  "recommendation_reasons": [
    "フォートラベル4.59（514件）・Tripadvisor系4.8（452件）と、性質の異なる2つの独立した情報源でいずれも十分な件数のもと高評価を確認できた。",
    "マエサトビーチ直結という立地に、ウィングごとに使い分けられる複数のプールを組み合わせた構成は他の石垣島リゾートにない強み。",
    "レストラン6店舗・スパ・キッズクラブなど施設が充実し、家族旅行からハネムーンまで幅広い層に対応できる。",
    "ウミガメと一緒に泳げるスポットとしても知られ、SNSでの話題性もある。"
  ],
  "evaluation_basis": "100点満点中78点（口コミ評価23/25・口コミ信頼性13/15・独自体験14/20・映え12/15・価格対体験価値6/10・SNS話題性6/10・アクセス/鮮度4/5）。フォートラベル4.59（514件）・Tripadvisor系4.8（452件）の2つの独立情報源で推奨ライン4.2以上を確認。比較検討したフサキビーチリゾート（フォートラベル4.33・275件のみ）、グランヴィリオリゾート石垣島（スカイチケット4.5・1,935件のみ）は、いずれも独立した2件目の数値評価情報源を確認できず原則7を満たせないため見送った。",
  "target_audience": ["家族", "カップル", "記念日", "絶景好き"],
  "why_now": "石垣島は10月中旬〜11月上旬も海水温が高く、台風ピークが過ぎて過ごしやすい『狙い目』のシーズン。夏の混雑・料金のピークを過ぎてもウミガメと泳げるなど海のアクティビティが楽しめる時期にあたる。",
  "price_note": "オーシャンスーペリア朝食付き49,000円〜、ベイスーペリア朝食付き68,000円〜、クラブスーペリア朝食付き78,000円〜（参考値）。クラブインターコンチネンタル利用時は3名目以降1名1泊17,000円の追加料金、チェックアウト時にリゾート料金が別途発生する場合がある。",
  "access_note": "石垣空港から車で約20分。マエサトビーチ目の前に位置する。",
  "captions": {
    "instagram": "マエサトビーチが目の前。ウミガメと泳げる石垣島のリゾート。\n\n📍沖縄県石垣市真栄里「ANAインターコンチネンタル石垣リゾート by IHG」\n\nマエサトビーチ直結のビーチフロントリゾート。レストラン6店舗に加え、ベイウィング前の『サンセットプール』、オーシャン・コーラルウィング宿泊者専用の『サンライズプール』、屋内プールやウォータースライダー付きガーデンプールなど、ウィングごとに使い分けられるプールが充実しています。周辺はウミガメと一緒に泳げるスポットとしても知られています。\n\nフォートラベルの口コミは514件で4.59、Tripadvisor系の集計でも452件で4.8（2026年10月時点）と、2つの独立したサイトで高評価が確認できました。\n\n✔️おすすめの人：家族旅行／カップル／記念日旅行／絶景好き\n✔️目安：オーシャンスーペリア朝食付き49,000円〜（部屋タイプ・時期により変動。リゾート料金等が別途かかる場合あり）\n✔️アクセス：石垣空港から車で約20分\n\n※価格・プラン内容は変動するため、予約時に公式サイトで最新情報をご確認ください。\n※本投稿は実際の宿泊レポートではなく、口コミ・公式情報をもとに構成した旅行メディア型の紹介です。\n\n海も空いてくる今のうちに、石垣島旅を保存しておいて。",
    "tiktok": "石垣島でウミガメと泳げるリゾート、知ってる？🐢\n『ANAインターコンチネンタル石垣リゾート』、マエサトビーチ目の前。\nサンセット・サンライズ・屋内・ウォータースライダーと4種類のプール。\nフォートラベル514件で4.59、Tripadvisor系でも452件で4.8の高評価。\n台風ピークが過ぎた今、保存しておこう。"
  },
  "hashtags": [
    "#石垣島", "#石垣島旅行", "#マエサトビーチ", "#ANAインターコンチネンタル", "#離島リゾート",
    "#沖縄旅行", "#ウミガメ", "#家族旅行", "#記念日旅行", "#秋の沖縄",
    "#国内旅行", "#贅沢旅"
  ],
  "sources": [
    { "type": "official", "title": "ANAインターコンチネンタル石垣リゾート - ANA国内ツアー", "url": "https://www.ana.co.jp/ja/jp/domtour/theme/premium_stay/anaihgishigaki/" },
    { "type": "review_site", "title": "ANAインターコンチネンタル石垣リゾート by IHG - フォートラベル", "url": "https://4travel.jp/dm_hotel-10053638" },
    { "type": "review_site", "title": "ANA InterContinental Ishigaki Resort - Japan Travel Centre", "url": "https://new.japantravel-centre.com/accommodation/2185/" },
    { "type": "booking_site", "title": "ANAインターコンチネンタル石垣リゾートby IHG - じゃらんnet", "url": "https://www.jalan.net/yad315164/" }
  ],
  "created_date": "2026-10-17"
}
