{
  "id": "2026-10-16-kai-sengokuhara",
  "candidate_id": "2026-10-16-kai-sengokuhara",
  "region": "神奈川県足柄下郡箱根町仙石原",
  "category": "絶景ホテル",
  "facility_overview": "星野リゾートの温泉旅館ブランド『界』15番目の施設として2018年に開業した『界 仙石原』。標高約700mの仙石原高原に位置し、大涌谷由来の白濁した湯を全16室（本館13室・別館3室）すべての露天風呂で楽しめる。『アトリエ×温泉旅館』をコンセプトに、参加アーティストの作品を客室に配置し、地域の工芸・食を体験する『ご当地楽』も提供。夕食の名物は熱した石で肉・魚介を焼く『山海石焼』。",
  "recommendation_reasons": [
    "じゃらんnet4.4（167件）・スカイチケット4.4（208件）と、性質の異なる2つの独立した情報源でいずれも高評価かつ十分なレビュー件数を確認できた。",
    "全16室すべてに大涌谷由来の白濁温泉の露天風呂が付くという点は、箱根の宿でも独自性が高い。",
    "『アトリエ×温泉旅館』という、アート体験と温泉旅館を組み合わせたコンセプトがここでしかできない体験になっている。",
    "1日1組限定の『仙石原アートリトリート滞在』など、新しい特別プランも展開している。"
  ],
  "evaluation_basis": "100点満点中76点（口コミ評価22/25・口コミ信頼性12/15・独自体験16/20・映え11/15・価格対体験価値6/10・SNS話題性5/10・アクセス/鮮度4/5）。じゃらんnet4.4（167件）・スカイチケット4.4（208件）の2つの独立情報源で推奨ライン4.2以上を確認。同エリアの箱根小涌園天悠・強羅花壇は、独自性・格式は高いものの、このセッションで確認できた数値評価が極端に少数のレビューしかなく（原則7未達）見送り、十分なレビュー件数の裏付けがある本候補を選定した。",
  "target_audience": ["カップル", "記念日", "夫婦", "温泉好き", "絶景好き"],
  "why_now": "箱根は10月中旬〜11月が紅葉シーズンの入口にあたる時期。秋の澄んだ空気の中、大涌谷由来の白濁温泉に露天風呂から浸かる体験が一年で特に映える季節で、紅葉本番前の予約検討にちょうどいいタイミング。",
  "price_note": "過去の掲載情報では1泊2食付き・2名1室利用時1名あたり37,000円〜、体験プラン付きで50,850円〜（税・サービス料込）という表示を確認。現在の正確な料金・プラン内容は公式サイトで要確認。",
  "access_note": "神奈川県足柄下郡箱根町仙石原817-359。標高約700mの仙石原高原に位置し、大涌谷まで比較的近いエリア。",
  "captions": {
    "instagram": "全16室、どの部屋にも大涌谷の白濁温泉露天風呂。\n\n📍神奈川県箱根町仙石原「星野リゾート 界 仙石原」\n\n標高約700mの仙石原高原にある、星野リゾートの温泉旅館ブランド『界』の一軒。本館13室・別館3室、すべての客室に大涌谷由来の白濁した湯の露天風呂が付いています。『アトリエ×温泉旅館』をコンセプトに、参加アーティストの作品が客室に飾られ、地域の工芸や食を体験する『ご当地楽』も用意。夕食の名物は、熱した石で肉・魚介を焼く『山海石焼』です。\n\nじゃらんnetの口コミは167件で4.4、スカイチケットでも208件で4.4（2026年10月時点）と、2つの独立したサイトで安定した高評価が確認できました。\n\n✔️おすすめの人：記念日の夫婦旅／カップル／温泉好き／絶景好き\n✔️目安：1泊2食1名37,000円台〜（体験プラン付きは50,850円〜、税・サービス料込の過去掲載情報。現在の料金は公式サイトで要確認）\n✔️アクセス：神奈川県箱根町仙石原、大涌谷エリア\n\n※価格・プラン内容は変動するため、予約時に公式サイトで最新情報をご確認ください。\n※本投稿は実際の宿泊レポートではなく、口コミ・公式情報をもとに構成した旅行メディア型の紹介です。\n\n紅葉前の箱根、保存しておいて。",
    "tiktok": "箱根に、全室大涌谷の白濁温泉がある宿、知ってる？♨️\n『界 仙石原』、本館・別館あわせて全16室すべて露天風呂付き。\n『アトリエ×温泉旅館』、客室にはアート作品も。\nじゃらん167件で4.4、スカイチケットも208件で4.4の高評価。\n紅葉前の箱根旅、保存しておこう。"
  },
  "hashtags": [
    "#界仙石原", "#箱根旅行", "#仙石原", "#大涌谷", "#箱根温泉",
    "#絶景ホテル", "#温泉旅館", "#星野リゾート", "#記念日旅行", "#夫婦旅",
    "#国内旅行", "#贅沢旅"
  ],
  "sources": [
    { "type": "official", "title": "星野リゾート 界 仙石原 公式サイト", "url": "https://kai-ryokan.jp/sengokuhara/" },
    { "type": "review_site", "title": "星野リゾート 界 仙石原の宿泊予約・クチコミ - じゃらんnet", "url": "https://www.jalan.net/yad358672/kuchikomi/" },
    { "type": "review_site", "title": "星野リゾート 界 仙石原 - スカイチケット", "url": "https://skyticket.jp/hotel/detail/property_961593/" },
    { "type": "other", "title": "箱根で温泉とアート三昧。「星野リゾート 界 仙石原」 - Matcha", "url": "https://matcha-jp.com/jp/6588" }
  ],
  "created_date": "2026-10-16"
}
