{
  "id": "2026-10-20-gero-suimeikan",
  "candidate_id": "2026-10-20-gero-suimeikan",
  "region": "岐阜県下呂市幸田（下呂温泉・JR高山本線「下呂」駅から徒歩約3分）",
  "category": "グルメ旅館",
  "facility_overview": "日本三名泉の一つ下呂温泉にある老舗大型旅館「水明館」。青嵐荘・臨川閣・飛泉閣・山水閣という4つの館からなり、下呂の街並みを見下ろす「展望大浴場」、檜造りでサウナも備える「下留の湯」、緑と巨岩に囲まれた野趣あふれる「野天風呂」の3大浴場を、どの館に泊まっても全て利用できる。食事は飛騨牛を中心に、和食会席・フレンチ・中華料理から選べるプランがある。",
  "recommendation_reasons": [
    "下呂駅徒歩3分という好アクセスに、3つの異なる趣の大浴場（展望・檜造り・野天）を1施設で湯めぐりできる独自性。",
    "jcation4.5（634件）・るるぶトラベル4.2（264件）という2つの独立した情報源で、いずれも採用ライン4.0以上を安定して満たし、件数も数百件規模で信頼度が高い。",
    "飛騨牛を中心に和食会席・フレンチ・中華料理から選べるグルメ旅館としての幅があり、『グルメ旅館』カテゴリにふさわしい食の訴求ができる。",
    "じゃらんアワード2025 OF THE YEAR『売れた宿大賞』東海エリアで12年連続1位という継続的な実績があり、直近も山水閣のリニューアル和洋室・飛騨牛付き会席の新プランなど話題材料がある。"
  ],
  "evaluation_basis": "100点満点中85点（口コミ評価23/25・口コミ信頼性13/15・独自体験17/20・映え12/15・価格対体験価値8/10・SNS話題性7/10・アクセス/鮮度5/5）。jcation4.5（634件）・るるぶトラベル4.2（264件）の2つの独立した情報源で採用ライン4.0以上を確認。一方で客室水回りの古さやエアコンの効きの弱さを指摘する口コミも一部あったが、清潔感・接客・料理に関わる重大な欠陥ではないため選定に影響しないと判断した。",
  "target_audience": ["夫婦", "記念日", "温泉好き", "グルメ旅"],
  "why_now": "10月下旬は秋の行楽シーズンで、飛騨牛をはじめとする飛騨の秋の味覚を使った会席料理の訴求がしやすい時期。紅葉シーズンに合わせた日本三名泉・下呂温泉への旅の検討needsが高まる時期でもある。",
  "price_note": "1泊2食付きで15,000円〜という掲載が複数サイトで確認できたが、4館・部屋タイプ・食事プラン（和食会席／フレンチ／中華）により大きく変動するため、予約前に公式サイト・予約サイトで要確認。",
  "access_note": "岐阜県下呂市幸田。JR高山本線「下呂」駅から徒歩約3分。",
  "captions": {
    "instagram": "1軒で3つの温泉を巡れる宿、知っていますか。\n\n📍岐阜県下呂温泉「水明館」（下呂駅から徒歩約3分）\n\n日本三名泉の一つ・下呂温泉にある老舗旅館で、4つの館（青嵐荘・臨川閣・飛泉閣・山水閣）を持つ大型旅館です。面白いのは、どの館に泊まっても、下呂の街並みを見下ろす「展望大浴場」、檜造りでサウナも備える「下留の湯」、緑と巨岩に囲まれた野趣あふれる「野天風呂」という3つの異なる趣の大浴場を全て使えること。1泊で温泉街を見下ろす湯・檜の湯・野天風呂と、まるで湯めぐりをしているような体験ができます。\n\n食事は飛騨牛を中心に、和食会席・フレンチ・中華料理から選べるプランがあり、グルメ旅館としての幅も魅力。直近では山水閣のリニューアル和洋室や、飛騨牛付き会席の新プランも登場しています。\n\n口コミはjcationで4.5（634件）、るるぶトラベルで4.2（264件）と、2つの独立したサイトでいずれも高評価。じゃらんアワードの『売れた宿大賞』東海エリアで12年連続1位という実績も、安定した支持の裏付けになっています。\n\n一方で、客室の水回りがやや古め、エアコンの効きが弱いという声も一部ありました。設備の新しさを最優先するタイプの宿ではなく、老舗の温泉と湯めぐりの豊かさを楽しむ宿として検討するのがよさそうです。\n\n✔️おすすめの人：夫婦・記念日旅行／温泉好き／グルメ旅好き\n✔️アクセス：岐阜県下呂市幸田（JR高山本線「下呂」駅から徒歩約3分）\n✔️価格：1泊2食15,000円〜（部屋タイプ・プランにより変動。予約前に要確認）\n\n※価格・プラン内容は変動するため、予約時に公式サイトで最新情報をご確認ください。\n※本投稿は実際の宿泊レポートではなく、口コミ・公式情報をもとに構成した旅行メディア型の紹介です。\n\n3つの湯めぐりができる下呂の宿、保存しておいて。",
    "tiktok": "1軒で3つの温泉巡れる宿、知ってる？♨️\n岐阜・下呂温泉『水明館』（下呂駅徒歩3分）。\n展望大浴場・檜造りの湯・野天風呂、どの館に泊まっても全部入れる。\n食事は飛騨牛中心に和食会席・フレンチ・中華から選べる。\njcation4.5（634件）、るるぶ4.2（264件）の高評価。\nじゃらんアワード12年連続1位の実績もある老舗旅館。\n湯めぐりできる下呂の宿、保存必須。"
  },
  "hashtags": [
    "#下呂温泉", "#水明館", "#下呂", "#岐阜旅行", "#日本三名泉",
    "#飛騨牛", "#湯めぐり", "#グルメ旅館", "#温泉旅行", "#記念日旅行",
    "#夫婦旅", "#国内旅行"
  ],
  "sources": [
    { "type": "review_site", "title": "下呂温泉 水明館 口コミ・評価（jcation／総合4.5・634件）", "url": "https://jcation.com/hotel/detail-885/" },
    { "type": "booking_site", "title": "下呂温泉 水明館（るるぶトラベル／クチコミ264件・4.2）", "url": "https://www.rurubu.travel/city/japan/gero" },
    { "type": "other", "title": "下呂温泉 水明館 施設紹介（飛騨牛会席・3大浴場・じゃらんアワード12年連続1位） - All About", "url": "https://news.allabout.co.jp/articles/o/108086/" },
    { "type": "booking_site", "title": "水明館 プラン一覧（山水閣リニューアル和洋室・飛騨牛付き会席プラン） - KNT", "url": "https://yado.knt.co.jp/planlist/S210044/" },
    { "type": "review_site", "title": "下呂温泉 水明館 口コミ（2026年3月投稿・客室水回り・エアコンへの指摘） - cocolocala", "url": "https://www.cocolocala.jp/hotels/14081" }
  ],
  "created_date": "2026-10-20"
}
