{
  "id": "2026-10-22-takachihokyou-boat",
  "candidate_id": "2026-10-22-takachihokyou-boat",
  "region": "宮崎県西臼杵郡高千穂町（高千穂峡）",
  "category": "アクティビティ",
  "facility_overview": "高千穂峡は、五ヶ瀬川の侵食によって作られた柱状節理の峡谷で、国指定の名勝・天然記念物。見どころである落差17mの『真名井の滝』のすぐ近くまで、手漕ぎの貸しボートで近づくことができる。ボートは1艇4,100円〜（30分・定員3名、未就学児を含む場合のみ最大4名）、営業時間は8:30〜17:00（最終受付16:30）、河川増水時は運休。",
  "recommendation_reasons": [
    "柱状節理の渓谷と落差17mの真名井の滝を、手漕ぎボートで間近に見られる、国内でも珍しい景勝地体験。",
    "じゃらんnet（471件・4.2）、Klook（191件・4.8）、KKday（547件・4.9）という独立した3つの情報源で、いずれも高評価かつ十分な件数を確認。",
    "国指定名勝・天然記念物というお墨付きがあり、ボート上で鯉や鴨にエサをあげられるなど、写真だけでなく体験としての満足度も高い。",
    "10月下旬〜11月は渓谷の紅葉が進み始め、朝晩の気温差で川霧が立ちやすく、夏の混雑期とは違う落ち着いた絶景が狙える時期。"
  ],
  "evaluation_basis": "100点満点中81点（口コミ評価20/25・口コミ信頼性13/15・独自体験18/20・映え14/15・価格対体験価値7/10・SNS話題性6/10・アクセス/鮮度3/5）。じゃらんnet（471件・4.2）、ボート体験付きツアーを扱うKlook（191件・4.8）・KKday（547件・4.9）という3つの独立した情報源すべてで、採用ライン4.0以上を大きく上回る評価を確認した。マイナス面として、繁忙期（夏休み等）は『ボートは3時間待ちで諦めた』という混雑の声や、『ネットで見た写真ほど綺麗ではなかった（雨後で川の色が出なかった）』という写真とのギャップを指摘する声が複数確認されたが、清潔感・接客・安全面での重大な欠陥は確認されず、不採用レベルの問題ではないと判断した。増水時は運休となる運用リスクがあるため、来訪前の最新情報確認を前提とする。",
  "target_audience": ["カップル", "家族", "友人", "絶景好き"],
  "why_now": "10月下旬〜11月は高千穂盆地で放射冷却が発生しやすく、渓谷の紅葉と朝霧が重なりやすい季節の変わり目。夏休みのような数時間待ちの混雑も落ち着き始める一方、冬の渇水期に比べて水量も安定しやすいタイミングで、ボート体験を落ち着いて楽しみやすい『狙い目』の時期といえる。",
  "price_note": "貸しボート30分4,100円〜5,100円程度／1艇（定員3名、未就学児を含む場合のみ最大4名）。価格は検索日・対象日・プランにより変動するため、来訪前に公式情報での確認が必須。",
  "access_note": "延岡駅・高千穂バスセンターから宮崎交通バスで高千穂バスセンターへ、徒歩約20分または路線バスで高千穂峡へ。熊本・延岡方面からの高速バスも運行。マイカー利用の場合は九州中央自動車道・高千穂日之影道路の利用が便利（最新の運行状況は要確認）。繁忙期は駐車場・貸しボート待ちの混雑が発生するため、午前の早い時間帯の来訪がおすすめ。",
  "captions": {
    "instagram": "柱状節理の渓谷を、手漕ぎボートで滝のすぐそばまで。\n\n📍宮崎県高千穂町・高千穂峡\n\n五ヶ瀬川の侵食が作り出した柱状節理の渓谷、国指定名勝・天然記念物の高千穂峡。見どころの『真名井の滝』（落差17m）のすぐ近くまで、貸しボートで近づくことができます。ボート上では鯉や鴨にエサをあげることもできて、写真だけでなく体験としても満足度が高いと評判。\n\nじゃらんnetでは471件という大きな母数で4.2の高評価、ボート体験付きツアーを扱うKlook・KKdayでもそれぞれ4.8・4.9という高評価を獲得しています。\n\n10月下旬〜11月は渓谷の紅葉が色づき始め、朝晩の気温差で川霧が立ちやすい季節の変わり目。夏休みのような数時間待ちの混雑が落ち着く一方、水量も安定しやすい『狙い目』のタイミングです。\n\n✔️おすすめの人：カップル／家族／友人旅／絶景好き\n✔️目安：貸しボート30分4,100円程度〜（時期・プランにより異なる）\n✔️アクセス：延岡・熊本方面からバス、高千穂バスセンターから徒歩・路線バス\n\n※繁忙期はボート待ちの混雑や、雨後は川の色が写真ほど鮮やかに見えないこともあるという声があります。増水時は運休となるため、来訪前に最新の運行状況をご確認ください。価格・営業状況は変動するため、公式情報の確認をおすすめします。\n※本投稿は実際の訪問レポートではなく、口コミ・公式情報をもとに構成した旅行メディア型の紹介です。\n\n一度は漕いでみたい、神話の里の渓谷ボート。保存して旅の計画に。",
    "tiktok": "宮崎に、ボートで滝に近づける渓谷があるって知ってた？\n高千穂峡、柱状節理の崖と真名井の滝の目の前まで\n手漕ぎボートでスーッと近づける🚣\nじゃらん471件で4.2、ツアー評価は4.8〜4.9の高評価。\n10月下旬〜11月は紅葉と朝霧が重なる狙い目シーズン。\n保存して、次の旅の計画に。"
  },
  "hashtags": ["#高千穂峡", "#高千穂", "#宮崎旅行", "#真名井の滝", "#貸しボート", "#九州旅行", "#神話の里", "#絶景好き", "#少し贅沢な旅", "#国内旅行", "#秋旅"],
  "sources": [
    { "type": "review_site", "title": "高千穂峡貸しボートのクチコミ一覧 - じゃらんnet", "url": "https://www.jalan.net/kankou/spt_guide000000175025/kuchikomi/" },
    { "type": "official", "title": "高千穂峡貸しボート｜高千穂町観光協会【公式】", "url": "https://takachiho-kanko.info/boat/detail.php" },
    { "type": "other", "title": "高千穂峡貸しボート／高千穂町", "url": "https://www.town-takachiho.jp/top/soshiki/kikakukanko/2/4/316.html" },
    { "type": "booking_site", "title": "高千穂峡とトロッコ列車日帰りツアー（ボート体験付き）- Klook", "url": "https://www.klook.com/ja/" },
    { "type": "booking_site", "title": "福岡発 阿蘇・高千穂峡日帰りツアー（ボートオプション付き）- KKday", "url": "https://www.kkday.com/ja/" }
  ],
  "created_date": "2026-10-22"
}
