{
  "id": "2026-10-22-shigira-mirage-miyako",
  "candidate_id": "2026-10-22-shigira-mirage-miyako",
  "region": "沖縄県宮古島市上野新里（シギラセブンマイルズリゾート内）",
  "category": "離島リゾート",
  "facility_overview": "宮古島南岸の複合リゾート『シギラセブンマイルズリゾート』内、2019年開業の大型ホテル『ホテル シギラミラージュ』。海側11階建ての『ベイサイド』棟と高台のヴィラタイプ『ヒルサイド』棟からなり、全室51㎡以上。最大の特徴は宿泊者専用の『シギラ黄金温泉 ジャングルプール』で、地下1,250mから湧く温泉を水着で楽しめる珍しいジャングル型プール。和食・地中海料理・ラウンジ&バーなど館内レストランも充実し、ジャグジー付き・プライベートプール付きのプールヴィラプレミアなど部屋タイプの選択肢も広い。",
  "recommendation_reasons": [
    "楽天トラベル4.74（357件）、じゃらん4.8（97件）という独立した2つの大手予約サイトでいずれも4.0を大きく上回る高評価を確認（原則6・7）。Skyticket集計では1,045件という厚い口コミ蓄積もある。",
    "水着で入る温泉『シギラ黄金温泉 ジャングルプール』は、宮古島の他の大型リゾートにはない独自設備で、温泉×リゾートプールという組み合わせの非日常感がある。",
    "ベイサイド棟（海側高層）とヒルサイド棟（高台ヴィラ）の2棟構成で、記念日のプールヴィラから家族向けの部屋まで選択肢が広い。",
    "同じシギラセブンマイルズリゾート内で既に選定済みの『ザ シギラ』（オールインクルーシブ、2026-10-20選定）とはコンセプト・価格帯が異なる別施設であり、宮古島・離島リゾートカテゴリとしても2026-09-18サイクルのヒルトン沖縄宮古島リゾート以来、新たな切り口の候補となる。"
  ],
  "evaluation_basis": "100点満点中81点（口コミ評価24/25・口コミ信頼性14/15・独自体験16/20・映え12/15・価格対体験価値6/10・SNS話題性6/10・アクセス/鮮度3/5）。主要レビューサイト評価は楽天トラベル4.74（357件）、じゃらん4.8（97件）の2独立情報源で採用ライン4.0以上を大きく上回る。負の口コミとしてjcation掲載の個別投稿（清掃対応の遅れ、共用設備のメンテ不備、スタッフ引き継ぎ漏れ、飲食施設での会計確認の注意）が1件確認されたが、これは単一の口コミに基づく指摘であり、数百〜千件規模の独立した口コミ全体では高評価が一貫しているため、重大な除外基準（原則10）には該当しないと判断した。",
  "target_audience": ["夫婦", "記念日", "家族", "ホテル好き", "絶景好き"],
  "why_now": "離島リゾートカテゴリは1回目の再調査（長崎県対馬）で該当施設なしだったため、依頼により2回目（最終）の再調査を実施。慶良間諸島（座間味島）は大型・中堅リゾートの実在が確認できなかったため対象外とし、複数の大型リゾートが実在することを確認できた宮古島エリアで調査を進めた。宮古島は10月下旬で台風ピークを過ぎ、11月以降も海水温が高く紫外線も本州の真夏より穏やかな『少し贅沢な秋冬の離島旅』の需要期にあたる。ホテル シギラミラージュは2026-10-20サイクルで『オールインクルーシブ』条件のみを確認する目的で一度候補に挙がったが、その際は口コミ評価の数値的な裏取りを行わずカテゴリ不一致で不採用としていた。本サイクルで正しいカテゴリ（離島リゾート）のもとレビュー評価を初めて本格的に調査した結果、採用ラインを満たすことが判明した。",
  "price_note": "朝食付きプランで大人1名あたり22,470円〜211,820円という幅広い価格情報を複数の旅行会社サイトで確認（デラックス／スーペリアルーム、時期・部屋タイプにより変動）。2名1室では目安4万円台後半〜、ジャグジー付き・プライベートプール付きのプールヴィラプレミア等の上位カテゴリでは1名25万円超のプランもある。具体的な最新料金・空室状況は公式サイト（shigira.com）や予約サイトでご確認ください。",
  "access_note": "沖縄県宮古島市上野新里、宮古島南岸の『シギラセブンマイルズリゾート』内。宮古空港から車で約15〜20分（空港・ホテル間の無料シャトルバスあり）。",
  "captions": {
    "instagram": "宮古島に、水着で入れる温泉ジャングルプールがあるって知ってた？\n\n📍沖縄県宮古島市「ホテル シギラミラージュ」（シギラセブンマイルズリゾート内）\n\n地下1,250mから湧く温泉を水着で楽しむ『シギラ黄金温泉 ジャングルプール』が名物の大型リゾート。海側の高層棟『ベイサイド』と、高台のヴィラタイプ『ヒルサイド』の2棟構成で、記念日仕様のプライベートプール付きヴィラから家族向けの部屋まで選べます。\n\n口コミは楽天トラベル4.74（357件）、じゃらん4.8（97件）と、独立した2つの大手予約サイトでいずれも高評価。Skyticket集計では1,045件という厚い口コミ蓄積があり、評価の安定感は宮古島の中でも際立っています。\n\n一部には『清掃対応がやや遅い』という声もありましたが、数百〜千件規模の口コミ全体では高評価が一貫しています。\n\n宮古島は11月以降も海の色が落ち着いていて、本州の真夏より紫外線も穏やかに過ごせる時期。温泉×リゾートプールという、ちょっと意外な非日常を味わいに行きませんか。\n\n✔️おすすめの人：夫婦／記念日旅行／家族／ホテル好き／絶景好き\n✔️特徴：水着で入る温泉ジャングルプール＋ベイサイド/ヒルサイド2棟構成\n✔️料金目安：1泊1名あたり約2.2万円〜（部屋タイプ・時期で変動）\n✔️アクセス：宮古空港から車で約15〜20分（無料シャトルあり）\n\n※価格・プラン内容・評価情報は変動するため、予約時に公式サイト・予約サイトで最新情報をご確認ください。\n※本投稿は実際の宿泊レポートではなく、口コミ・公式情報をもとに構成した旅行メディア型の紹介です。\n\n次の宮古島旅、ここも保存しておいて。",
    "tiktok": "宮古島に、水着で入れる温泉プールがあるホテル知ってる？🏝️\nホテル シギラミラージュ、シギラセブンマイルズリゾート内。\n地下1,250mの温泉を使ったジャングルプールが名物。\nベイサイド棟とヒルサイド棟の2棟構成で部屋タイプも豊富。\n口コミは楽天4.74（357件）、じゃらん4.8（97件）とどちらも高評価。\n次の宮古島旅、ここも候補に保存して。"
  },
  "hashtags": [
    "#ホテルシギラミラージュ", "#シギラセブンマイルズリゾート", "#宮古島", "#宮古島旅行",
    "#沖縄旅行", "#離島リゾート", "#記念日旅行", "#夫婦旅行",
    "#温泉プール", "#プライベートプール", "#国内旅行", "#贅沢旅"
  ],
  "sources": [
    { "type": "official", "title": "シギラセブンマイルズリゾート公式サイト（ホテル シギラミラージュ）", "url": "https://shigira.com/hotel/mirage" },
    { "type": "review_site", "title": "ホテルシギラミラージュ＜宮古島＞ に実際に泊まった方のクチコミ・レビュー【楽天トラベル】", "url": "https://travel.rakuten.co.jp/HOTEL/168769/review.html" },
    { "type": "review_site", "title": "ホテル シギラミラージュの口コミ・評判 - じゃらんnet", "url": "https://www.jalan.net/yad330808/kuchikomi/" },
    { "type": "review_site", "title": "ホテル シギラミラージュ 宿泊プラン・クチコミまとめ - skyticket", "url": "https://skyticket.jp/hotel/detail/property_907728/" },
    { "type": "other", "title": "ホテルシギラミラージュ クチコミ（個別口コミ含む） - jcation", "url": "https://jcation.com/hotel/detail-12062/" }
  ],
  "created_date": "2026-10-22"
}
