{
  "id": "2026-10-21-yuda-onsen-kokian",
  "candidate_id": "2026-10-21-yuda-onsen-kokian",
  "region": "山口県山口市湯田温泉2-7-1（湯田温泉・JR山口線「湯田温泉」駅から徒歩約10分）",
  "category": "グルメ旅館",
  "facility_overview": "山口県・湯田温泉にある全16室の和モダン旅館「やまぐち・湯田温泉 古稀庵」。全室に源泉100%かけ流しの露天風呂を備え、客室数を絞った分、庭園を含む静かな環境でゆったり過ごせる。食事は刺身や野菜握りなどを含む創作懐石で、宿泊者専用の大浴場も別途完備している。",
  "recommendation_reasons": [
    "全16室すべてに源泉100%かけ流しの露天風呂が付く、客室数を絞った和モダンの高級旅館という独自性。",
    "じゃらん4.8（320件）・楽天トラベル4.78（188件）という2つの独立した情報源で、いずれも採用ライン4.0以上を数百件規模の件数で安定して満たしている。",
    "刺身や野菜握りを含む創作懐石で、記念日利用を伝えると祝いプレートのサービスがあったという口コミもあり、記念日旅行での満足度が高い。",
    "湯田温泉は中国地方の主要温泉地のひとつながら、captions/・posts/の過去投稿には一度も登場しておらず、地域としても新規性がある。"
  ],
  "evaluation_basis": "100点満点中84点（口コミ評価24/25・口コミ信頼性14/15・独自体験16/20・映え12/15・価格対体験価値7/10・SNS話題性7/10・アクセス/鮮度4/5）。じゃらん4.8（320件）・楽天トラベル4.78（188件）の2つの独立した情報源で採用ライン4.0以上を確認。接客対応のばらつきを指摘する口コミが一部あったが、清潔感・料理に関わる重大な欠陥ではないため選定に影響しないと判断した。",
  "target_audience": ["夫婦", "記念日", "温泉好き", "グルメ旅"],
  "why_now": "10月下旬〜11月は山口県内陸部でも紅葉が進み始め、気候が安定して旅行需要が高まる時期。ふぐをはじめとした山口グルメとの組み合わせを訴求しやすい季節でもあり、客室数を絞った静かな旅館での記念日旅行の需要が高まるタイミング。",
  "price_note": "1泊2食付き34,560円〜57,240円という掲載が確認できた（全16室・客室タイプ・プランにより変動）。楽天トラベル掲載プランでは2026年4月に料金改定を実施したとの記載もあり、予約前に公式サイト・予約サイトで要確認。",
  "access_note": "山口県山口市湯田温泉2-7-1。JR山口線「湯田温泉」駅から徒歩約10分・車で約3分。",
  "captions": {
    "instagram": "全室、源泉かけ流しの露天風呂付き。知る人は知る山口の宿。\n\n📍山口県・湯田温泉「やまぐち・湯田温泉 古稀庵」（湯田温泉駅から徒歩約10分）\n\n全16室という小規模な和モダン旅館で、驚くのはすべての客室に源泉100%かけ流しの露天風呂が付いていること。部屋数を絞っている分、庭園を含む敷地はゆったりとした雰囲気で、宿泊者専用の大浴場も別で用意されています。\n\n食事は刺身や野菜握りを含む創作懐石。記念日旅行だと伝えると、祝いプレートのサービスがあったという口コミも見かけました。\n\n口コミはじゃらんで4.8（320件）、楽天トラベルで4.78（188件）と、2つの独立したサイトで数百件規模の高評価。接客対応に差を感じたという声も一部ありましたが、客室の温泉や料理への評価は総じて高いようです。\n\n✔️おすすめの人：夫婦・記念日旅行／温泉好き／グルメ旅好き\n✔️アクセス：山口県山口市湯田温泉（JR山口線「湯田温泉」駅から徒歩約10分）\n✔️価格：1泊2食34,560円〜（部屋タイプ・プランにより変動。予約前に要確認）\n\n※価格・プラン内容は変動するため、予約時に公式サイトで最新情報をご確認ください。\n※本投稿は実際の宿泊レポートではなく、口コミ・公式情報をもとに構成した旅行メディア型の紹介です。\n\n全室露天風呂付きの山口の宿、保存しておいて。",
    "tiktok": "全室、源泉かけ流しの露天風呂付き宿、知ってる？♨️\n山口・湯田温泉『古稀庵』（湯田温泉駅徒歩10分）。\n全16室、すべての部屋に源泉100%の露天風呂。\n食事は刺身・野菜握り入りの創作懐石で記念日のお祝いプレートも。\nじゃらん4.8（320件）、楽天トラベル4.78（188件）の高評価。\n山口の穴場グルメ旅館、保存必須。"
  },
  "hashtags": [
    "#湯田温泉", "#古稀庵", "#山口旅行", "#山口県",
    "#グルメ旅館", "#源泉かけ流し", "#露天風呂付き客室", "#温泉旅行",
    "#記念日旅行", "#夫婦旅", "#国内旅行", "#一度は泊まりたい"
  ],
  "sources": [
    { "type": "booking_site", "title": "やまぐち・湯田温泉 古稀庵（じゃらん／総合4.8・クチコミ320件）", "url": "https://www.jalan.net/yad372199" },
    { "type": "booking_site", "title": "やまぐち・湯田温泉 古稀庵（楽天トラベル／総合4.78・クチコミ188件）", "url": "https://travel.rakuten.co.jp/HOTEL/109362/review.html" },
    { "type": "review_site", "title": "やまぐち・湯田温泉 古稀庵 口コミまとめ（接客・バスタオル対応等への指摘） - icotto", "url": "https://icotto.jp/hotels/366" },
    { "type": "other", "title": "やまぐち・湯田温泉 古稀庵 施設紹介（全室源泉かけ流し露天風呂・創作懐石） - ことりっぷ", "url": "https://co-trip.jp/post/710602" },
    { "type": "other", "title": "やまぐち・湯田温泉 古稀庵 プラン情報（JTBお客様アンケート評価97） - JTB", "url": "https://www.jtb.co.jp/kokunai-hotel/htl/7226038/" }
  ],
  "created_date": "2026-10-21"
}
