{
  "id": "2026-10-20-oigawa-sl-train",
  "candidate_id": "2026-10-20-oigawa-sl-kawaneji",
  "region": "静岡県島田市（金谷駅・新金谷駅発、大井川本線 金谷〜川根温泉笹間渡）",
  "category": "列車・船",
  "facility_overview": "大井川鐵道は、1976年に全国の鉄道事業者に先駆けて蒸気機関車（SL）の動態保存運行を始めた、日本最初のSL観光鉄道。現在も年間300日以上SLが走り、SL急行『かわね路号』は金谷駅・新金谷駅から大井川の渓谷沿いを進む。冷房のないレトロな旧型客車に乗ると、窓の下の栓抜きなど懐かしい雰囲気がそのまま残る。終点側の井川線まで足を延ばせば、日本で唯一のアプト式区間や、湖に浮かぶように見える奥大井湖上駅もある。2026年3月にはアジア初『きかんしゃパーシー号』の実車運行も始まり、鉄道ファン・ファミリー層からの注目度がさらに高まっている。",
  "recommendation_reasons": [
    "Tripadvisor（4.6点／236件、Shimadaの観光スポット67件中1位）とAirial Travel（4.3点／275件）という独立した2つの情報源でいずれも4.0を大きく超える高評価を確認。",
    "1976年から続く『日本初のSL動態保存運行』という、国内でも歴史的な独自性。",
    "2026年3月にアジア初『きかんしゃパーシー号』実車運行が始まり、『DAY OUT WITH THOMAS』も2026年から初の通年開催という新しい話題性。",
    "渓谷沿いを走るレトロな客車と白い蒸気という、写真・動画映えする構図。",
    "SL急行券は片道2,520円程度からとされ、『ちょっと贅沢な旅』として手が届きやすい価格帯。"
  ],
  "evaluation_basis": "100点満点中80点（口コミ評価22/25・口コミ信頼性11/15・独自体験17/20・映え13/15・価格対体験価値7/10・SNS話題性6/10・アクセス/鮮度4/5）。Tripadvisor（4.6点／236件、評価内訳はExcellent159・Good61・Average13・Poor3・Terrible0と良好な分布）とAirial Travel（4.3点／275件）という性質の異なる2つの情報源で確認した。マイナス面として、個別レビューで『雨天時に旧型客車の天井から雨漏りがあった』『駅弁の味は普通程度だった』という指摘、2023年11月に家山駅構内で発生した車両分離（鉄道重大インシデント、死傷者報告なし・2024年11月時点で原因調査中）、2022年の台風被害により川根温泉笹間渡〜千頭間が現在も不通（全線復旧は2029年春頃見通し）であることを確認したが、SL急行自体が走る区間は通常運行を継続しており、不採用レベルの重大な問題はないと判断した。",
  "target_audience": ["家族", "カップル", "友人", "絶景好き"],
  "why_now": "2026年3月、大井川鐵道でアジア初となる『きかんしゃパーシー号』の実車運行がスタートし、人気イベント『DAY OUT WITH THOMAS』も2026年から初の通年開催に広がった。1976年から半世紀にわたり日本初のSL動態保存運行を続けてきた老舗観光鉄道が、2026年も新しい話題を加えて進化を続けているタイミング。紅葉シーズンの渓谷の景色とレトロな蒸気機関車の組み合わせは、秋の『少し贅沢な旅』として保存・シェアされやすい。",
  "price_note": "SL急行券（乗車券に加えて必要）は片道大人2,520円程度・要予約という掲載が島田市の観光資料で見られた。座席未指定で良い場合は大井川本線フリーきっぷ（SL運行日は4,800円程度）という選択肢もある。価格は検索日・対象日・プラン・きっぷの種類により変動するため、予約時に公式サイトでの確認が必須。",
  "access_note": "JR東海道新幹線・在来線で静岡方面からJR金谷駅へ（金谷駅でSL急行に乗り換え可能）。2022年の台風被害により川根温泉笹間渡〜千頭間（19.5km）は現在も不通で代行バスが運行中、全線復旧は2029年春頃の見通し。SL急行『かわね路号』自体は不通区間より手前の金谷〜川根温泉笹間渡間で通常運行を継続している。2026年1月からは動態保存機のうち『黒いSL』（C10形8号機）が改造のため運転休止中（代走はEL牽引の『ブルートレイン急行』）だが、他のSL機関車による運行は続いている。最新の運転日・運転区間・料金は大井川鐵道公式サイトで必ず確認を。",
  "captions": {
    "instagram": "白い蒸気を上げて、渓谷沿いをゆっくり走る——日本で一番長くSLが走り続けている鉄道、知ってますか。\n\n📍静岡県島田市・大井川鐵道（金谷駅・新金谷駅発）\n\n1976年、全国の鉄道事業者に先駆けてSLの動態保存運行を始めたのが大井川鐵道。今も年間300日以上、レトロな旧型客車を連れたSL急行『かわね路号』が大井川の渓谷沿いを走っています。\n\n2026年3月には、アジア初『きかんしゃパーシー号』の実車運行もスタート。人気イベント『DAY OUT WITH THOMAS』も今年から通年開催に。半世紀続く老舗の観光鉄道が、今も新しい話題を重ねています。\n\n口コミでも高評価（Tripadvisor 4.6点・236件、Airial Travel 4.3点・275件）。\n\n✔️おすすめの人：家族／カップル／友人旅／絶景好き\n✔️目安：SL急行券 片道2,520円程度〜（きっぷの種類・時期により変動）\n✔️出発：大井川鐵道 金谷駅・新金谷駅（JR金谷駅接続）\n\n※2022年の台風被害で一部区間（川根温泉笹間渡〜千頭）は現在も代行バス運行中。SL急行が走る区間は通常運行中です。最新の運転日・料金は公式サイトでご確認ください。\n※本投稿は実際の乗車レポートではなく、口コミ・公式情報・報道をもとに構成した旅行メディア型の紹介です。\n\n一度は乗ってみたい、日本最古のSLの旅。保存して計画に。",
    "tiktok": "日本で一番古くからSLが走ってる鉄道、知ってる？🚂\n静岡・大井川鐵道。\n1976年から半世紀、ずっとSLが走り続けてる。\n2026年3月にはアジア初『きかんしゃパーシー号』も登場！\n渓谷沿いをゆっくり走る蒸気機関車、口コミも高評価。\n一度は乗ってみたい景色、保存しておこう。"
  },
  "hashtags": ["#大井川鐵道", "#SL急行", "#かわね路号", "#蒸気機関車", "#静岡旅行", "#島田市", "#大井川", "#絶景好き", "#少し贅沢な旅", "#国内旅行", "#静岡観光"],
  "sources": [
    { "type": "official", "title": "大井川鐵道株式会社 公式サイト", "url": "https://daitetsu.jp/" },
    { "type": "review_site", "title": "Oigawa Railway Co. - Tripadvisor（4.6／236件、Shimada観光スポット67件中1位）", "url": "https://www.tripadvisor.com/Attraction_Review-g780859-d2690936-Reviews-Oigawa_Railway_Co-Shimada_Shizuoka_Prefecture_Tokai_Chubu.html" },
    { "type": "other", "title": "Oigawa Railway SL - Airial Travel（4.3／275件）", "url": "https://airial.travel/attractions/japan/shimada/oigawa-railway-sl-3fywIoAK" },
    { "type": "press", "title": "「黒いSL」の運転休止と「ブルートレイン急行」代走、「きかんしゃパーシー号」実車運行開始 - 鉄道チャンネル", "url": "https://tetsudo-ch.com/12895288.html" },
    { "type": "other", "title": "大井川鉄道が運休が続く区間の復旧工事を公開　全線再開は2029年春の見通し - あなたの静岡新聞", "url": "https://www.at-s.com/snews/article/ats/1994450.html" }
  ],
  "created_date": "2026-10-20"
}
