{
  "id": "2026-10-21-rihga-royal-hiroshima-aquarium-afternoontea",
  "candidate_id": "2026-10-21-rihga-royal-hiroshima-aquarium-afternoontea",
  "region": "広島県広島市中区基町（紙屋町・広島城周辺）",
  "category": "その他",
  "facility_overview": "広島市中区の複合施設『基町クレド・パセーラ』内、2025年10月開業の都市型水族館『広島もとまち水族館』の開館1周年を記念し、同じ複合施設内にあるリーガロイヤルホテル広島の最上階33階『スカイダイニング リーガトップ』（地上約125m）で、2026年10月31日(土)〜11月30日(月)の期間限定・1日10名限定でコラボレーションアフタヌーンティーを提供。水族館内の8つの展示シーン（クラゲ・チンアナゴ・ヒトデ等）をモチーフにしたスイーツ・セイボリーを、広島市街を一望する高層階の眺めとともに楽しめる。",
  "recommendation_reasons": [
    "Skyticket4.5点（8,769件）、Trip.com4.5点（212件）という性質の異なる2つの独立した情報源でいずれも推奨ライン4.2以上を上回る評価を確認した（原則6・7）。",
    "2025年10月開業の都市型水族館『広島もとまち水族館』の開館1周年という『今だけ』の節目企画で、館内8展示シーンをモチーフにしたスイーツという、広島市内のアフタヌーンティーの中でも独自性・話題性が高い構成。",
    "33階・地上約125mからの広島市街の眺めも加わり、水族館カラーのスイーツと夜景・街並みのコントラストが映える。",
    "1日10名限定という希少性があり、『今予約しないと』という保存・来訪意欲を後押しできる。",
    "調査日（10/21）時点でまだ開始前（10/31〜）のため、『まもなく始まる』を訴求できる投稿タイミングでもある。"
  ],
  "evaluation_basis": "100点満点中84点（口コミ評価22/25・口コミ信頼性13/15・独自体験18/20・映え13/15・価格対体験価値7/10・SNS話題性6/10・アクセス/鮮度5/5）。Skyticket4.5点（8,769件）・Trip.com4.5点（212件）の2つの独立情報源で推奨ライン4.2以上を上回る評価を確認（原則6・7）。同じ広島市内のヒルトン広島『ハーベスト』アフタヌーンティー（Trip.com・Traveloka換算で約4.65〜4.80点、score74点）は口コミ自体は良好だったが、柿・栗を主役にした企画内容が他都市でも定番的で独自性に欠けるため見送り、オリエンタルホテル広島『Harvest Tea Party』はフォートラベル3.81点（102件）が推奨ライン4.0に届かず（score58点）見送った。",
  "target_audience": ["カップル", "記念日", "女子旅", "ホテル好き", "絶景好き"],
  "why_now": "2026年10月31日〜11月30日の期間限定・1日10名限定企画で、2025年10月開業の水族館の『開館1周年』という一度きりの節目に合わせた企画のため、来年以降は同じ内容が再現される保証がない『今しか見られない』タイミング。秋の広島旅行を検討し始める時期とも重なる。",
  "price_note": "1名5,500円、広島もとまち水族館の入館券付きプランは1名7,300円という表示をWebSearchのスニペット（プレスリリース概要）で確認。正確な料金・プラン内容・予約方法は公式サイト・予約サイトで要確認。",
  "access_note": "広島県広島市中区基町、複合施設『基町クレド・パセーラ』内。広島バスセンターから徒歩約3分、紙屋町・広島城からも徒歩圏内でアクセス良好。",
  "captions": {
    "instagram": "水族館の世界を、33階の空に浮かせて。\n\n📍広島県広島市中区基町「リーガロイヤルホテル広島」33F スカイダイニング リーガトップ\n\n同じ複合施設内にある都市型水族館『広島もとまち水族館』（2025年10月開業）の開館1周年を記念して、2026年10月31日(土)〜11月30日(月)の期間限定・1日10名限定でコラボレーションアフタヌーンティーが登場します。\n\nクラゲ、チンアナゴ、ヒトデ…水族館の8つの展示シーンをモチーフにしたスイーツ・セイボリーが、地上約125mから広島市街を一望できる最上階のラウンジに並ぶという、ここでしか体験できない組み合わせ。\n\nホテル自体の口コミはSkyticket4.5点（8,769件）、Trip.com4.5点（212件）といずれも高評価（2026年10月時点）。1日10名限定なので、気になった人は早めの予約がおすすめです。\n\n✔️おすすめの人：カップル／記念日／女子旅／ホテル好き／絶景好き\n✔️期間：2026年10月31日(土)〜11月30日(月)・1日10名限定\n✔️料金：1名5,500円、水族館入館券付きプランは1名7,300円（参考値）\n✔️アクセス：広島バスセンターから徒歩約3分\n\n※価格・プラン内容は変動するため、予約時に公式サイトで最新情報をご確認ください。\n※本投稿は実際の来店レポートではなく、公式情報・口コミをもとに構成した旅行メディア型の紹介です。\n\n1日10名限定、今だけの企画。保存して、秋の広島旅の候補に。",
    "tiktok": "広島に、水族館が空に浮く日が来た🪼\nリーガロイヤルホテル広島33F、地上125mのスカイダイニングで『広島もとまち水族館』開館1周年コラボアフタヌーンティー。\n10/31〜11/30限定、1日10名だけ。\nクラゲ・チンアナゴ・ヒトデ…水族館の8シーンをスイーツで再現。\nホテルの口コミはSkyticket4.5点（8,769件）と高評価。\n保存して、秋の広島旅の候補に。"
  },
  "hashtags": [
    "#リーガロイヤルホテル広島",
    "#広島もとまち水族館",
    "#広島旅行",
    "#広島ホテル",
    "#アフタヌーンティー",
    "#期間限定",
    "#絶景カフェ",
    "#女子旅",
    "#記念日",
    "#国内旅行",
    "#贅沢旅"
  ],
  "sources": [
    { "type": "press", "title": "リーガロイヤルホテル広島「広島もとまち水族館 開館1周年記念 コラボレーションアフタヌーンティー」提供開始 - san-tatsu.jp（プレスリリース掲載）", "url": "https://san-tatsu.jp/pressrelease/559091/" },
    { "type": "review_site", "title": "リーガロイヤルホテル広島 口コミ・評価 - Skyticket", "url": "https://skyticket.jp/hotel/detail/property_14978/" },
    { "type": "review_site", "title": "Rihga Royal Hotel Hiroshima reviews - Trip.com", "url": "https://www.trip.com/hotels/hiroshima-hotel-detail-2005862/" },
    { "type": "other", "title": "広島もとまち水族館×リーガロイヤルホテル広島 コラボ企画一覧 - resemom.jp（PR Times配信）", "url": "https://resemom.jp/release/prtimes/20251128/164645.html" }
  ],
  "created_date": "2026-10-21"
}
